{
  "schemaVersion": 1,
  "tool": {
    "name": "statsig-audit",
    "version": "0.2.0"
  },
  "evaluatedAt": "2026-10-14T09:00:00.000Z",
  "snapshot": {
    "fetchedAt": "2026-10-14T09:00:00.000Z",
    "source": "fixture",
    "projectName": "Acme Pantry (fictional)",
    "auditLogDays": 30,
    "deep": true,
    "requests": null
  },
  "summary": {
    "findings": 46,
    "bySeverity": {
      "high": 13,
      "medium": 24,
      "low": 9
    },
    "suppressed": 1,
    "score": {
      "value": 42,
      "cleanEntities": 19,
      "auditedEntities": 45
    },
    "inventory": {
      "gates": {
        "total": 20,
        "archived": 1,
        "stale": 3,
        "permanent": 2
      },
      "dynamicConfigs": {
        "total": 3,
        "archived": 0,
        "stale": 1
      },
      "experiments": {
        "total": 9,
        "byStatus": {
          "abandoned": 1,
          "active": 5,
          "archived": 1,
          "decision_made": 1,
          "setup": 1
        }
      },
      "segments": {
        "total": 4
      },
      "metrics": {
        "total": 9,
        "builtIn": 2,
        "verified": 6,
        "hidden": 1
      },
      "layers": {
        "total": 4,
        "implicit": 1
      },
      "holdouts": {
        "total": 1,
        "enabled": 1
      },
      "tags": {
        "total": 7
      },
      "auditLogs": {
        "total": 15
      },
      "users": {
        "total": 5
      }
    }
  },
  "checks": [
    {
      "id": "G01",
      "title": "Gates Statsig marked stale",
      "severity": "medium",
      "status": "ran",
      "reason": null,
      "findings": 3,
      "suppressed": 0
    },
    {
      "id": "G02",
      "title": "Launched or disabled gates past their cleanup window",
      "severity": "medium",
      "status": "ran",
      "reason": null,
      "findings": 2,
      "suppressed": 0
    },
    {
      "id": "G03",
      "title": "In-progress gates that serve everyone the same value",
      "severity": "medium",
      "status": "ran",
      "reason": null,
      "findings": 1,
      "suppressed": 0
    },
    {
      "id": "G04",
      "title": "Partial rollouts left alone",
      "severity": "medium",
      "status": "ran",
      "reason": null,
      "findings": 1,
      "suppressed": 0
    },
    {
      "id": "G06",
      "title": "Gates with no traffic",
      "severity": "medium",
      "status": "ran",
      "reason": null,
      "findings": 1,
      "suppressed": 0
    },
    {
      "id": "G08",
      "title": "Conditions with no values",
      "severity": "high",
      "status": "ran",
      "reason": null,
      "findings": 1,
      "suppressed": 0
    },
    {
      "id": "G09",
      "title": "Targeting values that will not match",
      "severity": "high",
      "status": "ran",
      "reason": null,
      "findings": 1,
      "suppressed": 0
    },
    {
      "id": "G10",
      "title": "The same ID list pasted into several entities",
      "severity": "medium",
      "status": "ran",
      "reason": null,
      "findings": 1,
      "suppressed": 0
    },
    {
      "id": "G11",
      "title": "Rules that can never run",
      "severity": "medium",
      "status": "ran",
      "reason": null,
      "findings": 1,
      "suppressed": 0
    },
    {
      "id": "G12",
      "title": "References to missing, archived or disabled entities",
      "severity": "high",
      "status": "ran",
      "reason": null,
      "findings": 5,
      "suppressed": 0
    },
    {
      "id": "G13",
      "title": "Missing description, owner or tags",
      "severity": "low",
      "status": "ran",
      "reason": null,
      "findings": 2,
      "suppressed": 0
    },
    {
      "id": "G14",
      "title": "Owners who are no longer project members",
      "severity": "medium",
      "status": "ran",
      "reason": null,
      "findings": 3,
      "suppressed": 0
    },
    {
      "id": "D01",
      "title": "Dynamic configs Statsig marked stale",
      "severity": "medium",
      "status": "ran",
      "reason": null,
      "findings": 1,
      "suppressed": 0
    },
    {
      "id": "E02",
      "title": "Decided or abandoned experiments not cleaned up",
      "severity": "medium",
      "status": "ran",
      "reason": null,
      "findings": 2,
      "suppressed": 0
    },
    {
      "id": "E03",
      "title": "Experiments running past their plan",
      "severity": "medium",
      "status": "ran",
      "reason": null,
      "findings": 3,
      "suppressed": 0
    },
    {
      "id": "E04",
      "title": "Experiments without a hypothesis or the right metrics",
      "severity": "high",
      "status": "ran",
      "reason": null,
      "findings": 3,
      "suppressed": 0
    },
    {
      "id": "E05",
      "title": "Several comparisons with no correction",
      "severity": "medium",
      "status": "ran",
      "reason": null,
      "findings": 1,
      "suppressed": 0
    },
    {
      "id": "E06",
      "title": "Running experiments with failing health checks",
      "severity": "high",
      "status": "ran",
      "reason": null,
      "findings": 1,
      "suppressed": 0
    },
    {
      "id": "E09",
      "title": "Experiments whose targeting gate lets nobody in",
      "severity": "high",
      "status": "ran",
      "reason": null,
      "findings": 2,
      "suppressed": 0
    },
    {
      "id": "X01",
      "title": "Layers no experiment uses",
      "severity": "low",
      "status": "ran",
      "reason": null,
      "findings": 1,
      "suppressed": 1
    },
    {
      "id": "X02",
      "title": "Segments nothing uses, and empty ID lists",
      "severity": "low",
      "status": "ran",
      "reason": null,
      "findings": 2,
      "suppressed": 0
    },
    {
      "id": "X03",
      "title": "Running experiments decided by metrics nobody vouched for",
      "severity": "medium",
      "status": "ran",
      "reason": null,
      "findings": 2,
      "suppressed": 0
    },
    {
      "id": "A01",
      "title": "Gates and configs whose rules keep changing",
      "severity": "medium",
      "status": "ran",
      "reason": null,
      "findings": 1,
      "suppressed": 0
    },
    {
      "id": "A02",
      "title": "No required review for changes",
      "severity": "medium",
      "status": "ran",
      "reason": null,
      "findings": 1,
      "suppressed": 0
    },
    {
      "id": "N01",
      "title": "Names off convention, scratch entities and tag drift",
      "severity": "low",
      "status": "ran",
      "reason": null,
      "findings": 4,
      "suppressed": 0
    }
  ],
  "findings": [
    {
      "check": "G08",
      "title": "Conditions with no values",
      "severity": "high",
      "entity": {
        "type": "gate",
        "id": "gift_cards",
        "name": null,
        "permalink": "https://console.statsig.com/acme-pantry-example/gates/gift_cards",
        "owner": "Riley Santos",
        "ownerEmail": null
      },
      "message": "In rule \"Pilot stores\", the custom field store_id condition (any) has no values, so it matches no user.",
      "action": "Add the values the rule was meant to target, or delete the condition.",
      "related": []
    },
    {
      "check": "G09",
      "title": "Targeting values that will not match",
      "severity": "high",
      "entity": {
        "type": "gate",
        "id": "new_checkout_flow",
        "name": null,
        "permalink": "https://console.statsig.com/acme-pantry-example/gates/new_checkout_flow",
        "owner": "Avery Chen",
        "ownerEmail": null
      },
      "message": "In rule \"Staff\", the email condition (any) has leading or trailing spaces in \"n…@acme-pantry.example \"; a domain one letter away from acme-pantry.example in \"t…@acme-pantry.exmple\".",
      "action": "Fix the listed values in the rule. For long lists, move them into an ID list segment.",
      "related": []
    },
    {
      "check": "G12",
      "title": "References to missing, archived or disabled entities",
      "severity": "high",
      "entity": {
        "type": "experiment",
        "id": "cart_reminder_timing",
        "name": null,
        "permalink": "https://console.statsig.com/acme-pantry-example/experiments/cart_reminder_timing",
        "owner": "Jordan Blake",
        "ownerEmail": null
      },
      "message": "It is assigned to layer growth_layer_v0, which does not exist.",
      "action": "Point the rule at the right gate or segment, or remove the condition. Restore the target if it was archived by mistake.",
      "related": []
    },
    {
      "check": "G12",
      "title": "References to missing, archived or disabled entities",
      "severity": "high",
      "entity": {
        "type": "gate",
        "id": "loyalty_points",
        "name": null,
        "permalink": "https://console.statsig.com/acme-pantry-example/gates/loyalty_points",
        "owner": "Morgan Ellis",
        "ownerEmail": null
      },
      "message": "In rule \"Loyalty members\", passes_segment points at segment loyalty_members_v1, which does not exist.",
      "action": "Point the rule at the right gate or segment, or remove the condition. Restore the target if it was archived by mistake.",
      "related": []
    },
    {
      "check": "G12",
      "title": "References to missing, archived or disabled entities",
      "severity": "high",
      "entity": {
        "type": "gate",
        "id": "wine_delivery",
        "name": null,
        "permalink": "https://console.statsig.com/acme-pantry-example/gates/wine_delivery",
        "owner": "Avery Chen",
        "ownerEmail": null
      },
      "message": "In rule \"Legacy beta\", passes_segment points at segment legacy_beta_users, which is disabled, so it matches nobody.",
      "action": "Point the rule at the right gate or segment, or remove the condition. Restore the target if it was archived by mistake.",
      "related": []
    },
    {
      "check": "G12",